ἔνθεν οἰνίζοντο κάρη κομόωντες Ἀχαιοί,	-- ---u u- uu-u u--	dactylic hexameter	feminine penthemimeral, hepthemimeral
ἄλλοι μὲν χαλκῷ, ἄλλοι δ’αἴθωνι σιδήρῳ,	-- - -- -- --u u--	dactylic hexameter	masculine penthemimeral, hepthemimeral, trithemimeral
ἄλλοι δὲ ῥινοῖς, ἄλλοι δ’αὐτῇσι βόεσσιν,	-- - -- -- --u u--	dactylic hexameter	masculine penthemimeral, hepthemimeral, trithemimeral
ἄλλοι δ’ἀνδραπόδεσσι· τίθεντο δὲ δαῖτα θάλειαν.	-- -uu-u u-u u -u u--	dactylic hexameter	feminine penthemimeral
παννύχιοι μὲν ἔπειτα κάρη κομόωντες Ἀχαιοὶ	-uu- u u-u u- uu-u u--	dactylic hexameter	feminine penthemimeral, hepthemimeral, trithemimeral
δαίνυντο, Τρῶες δὲ κατὰ πτόλιν ἠδ’ ἐπίκουροι·	--- -- u u- uu - uu--	dactylic hexameter	masculine penthemimeral, hepthemimeral, trithemimeral
παννύχιος δέ σφιν κακὰ μήδετο μητίετα Ζεὺς	-uu- - - uu -uu -uu- -	dactylic hexameter	masculine penthemimeral, trithemimeral
σμερδαλέα κτυπέων· τοὺς δὲ χλωρὸν δέος ᾕρει·	-uu- uu- - - -- uu --	dactylic hexameter	masculine penthemimeral, hepthemimeral, trithemimeral
οἶνον δ’ἐκ δεπάων χαμάδις χέον, οὐδέ τις ἔτλη	-- - uu- uu- uu -u u --	dactylic hexameter	masculine penthemimeral, hepthemimeral, trithemimeral
πρὶν πιέειν πρὶν λεῖψαι ὑπερμενέϊ Κρονίωνι.	- uu- - -u u-uu- uu--	dactylic hexameter	feminine penthemimeral, trithemimeral
κοιμήσαντ’ ἄρ’ ἔπειτα καὶ ὕπνου δῶρον ἕλοντο.	--- u u-u u -- -u u--	dactylic hexameter	feminine penthemimeral, trithemimeral
