λέξω τὰ πάντα νητρεκῶς, ἅ μ᾽ἱστορεῖς,	-- u -u -u- u -u-	iambic trimeter (tragic)	
ἀρχῆς ἀπ᾽ ἄκρας· ἢν δὲ μηκυνθῇ λόγος,	-- u -- - u --- u-	iambic trimeter (tragic)	
σύγγνωθι δέσποτ᾽· οὐ γὰρ ἥσυχος κόρη	--u -u - u -u- u-	iambic trimeter (tragic)	
ἔλυσε χρησμῶν, ὡς πρίν, αἰόλον στόμα,	u-u -- - u -u- u-	iambic trimeter (tragic)	
ἀλλ᾽ ἄσπετον χέασα παμμιγῆ βοὴν	- -u- u-u -u- u-	iambic trimeter (tragic)	
δαφνηφάγων φοίβαζεν ἐκ λαιμῶν ὄπα,	--u- --u - -- u-	iambic trimeter (tragic)	
Σφιγγὸς κελαινῆς γῆρυν ἐκμιμουμένη.	-- u-- -u -u-u-	iambic trimeter (tragic)	
τῶν ἅσσα θυμῷ καὶ διὰ μνήμης ἔχω,	- -u -- - u- -- u-	iambic trimeter (tragic)	
κλύοις ἄν, ὦναξ, κἀναπεμπάζων φρενὶ	u- u -- -u--- u-	iambic trimeter (tragic)	
πυκνῇ διοίχνει δυσφάτους αἰνιγμάτων	-- u-- -u- --u-	iambic trimeter (tragic)	
οἴμας τυλίσσων, ᾗπερ εὐμαθὴς τρίβος	-- u-- -u -u- u-	iambic trimeter (tragic)	
ὀρθῇ κελεύθῳ τἀν σκότῳ ποδηγετεῖ.	-- u-- - u- u-u-	iambic trimeter (tragic)	
ἐγὼ δ᾽ἄκραν βαλβῖδα μηρίνθου σχάσας,	u- u- --u --- u-	iambic trimeter (tragic)	
ἄνειμι λοξῶν εἰς διεξόδους ἐπῶν,	u-u -- - u-u- u-	iambic trimeter (tragic)	
πρώτην ἀράξας νύσσαν ὡς πτηνὸς δρομεύς.	-- u-- -u - -- u-	iambic trimeter (tragic)	
Ἠὼς μὲν αἰπὺν ἄρτι Φηγίου πάγον	-- u -u -u -u- u-	iambic trimeter (tragic)	
κραιπνοῖς ὑπερποτᾶτο Πηγάσου πτεροῖς,	-- u-u-u -u- u-	iambic trimeter (tragic)	
Τιθωνὸν ἐν κοίταισι τῆς Κέρνης πέλας	u-u - --u - -- u-	iambic trimeter (tragic)	
λιποῦσα, τὸν σὸν ἀμφιμήτριον κάσιν.	u-u - u -u-u- u-	iambic trimeter (tragic)	
οἱ δ᾽οὖσα γρώνης εὐγάληνα χερμάδος	- -u -- -u-u -u-	iambic trimeter (tragic)	
ναῦται λίαζον κἀπὸ γῆς ἐσχάζοσαν	-- u-- -u - --u-	iambic trimeter (tragic)	
ὕσπληγγας. αἱ δὲ παρθενοκτόνον Θέτιν	--u - u -u-u- u-	iambic trimeter (tragic)	
ἰουλόπεζοι θεῖνον εὐῶπες σπάθαις	u-u-- -u --- u-	iambic trimeter (tragic)	
πελαργοχρῶτες, αἱ Φαλακραῖαι κόραι,	u-u-u - u--- u-	iambic trimeter (tragic)	
ὑπὲρ Καλυδνῶν λευκὰ φαίνουσαι πτίλα,	u- u-- -u --- u-	iambic trimeter (tragic)	
ἄφλαστα, καὶ φώσσωνας ὠργυιωμένους	u-u - --u ---u-	iambic trimeter (tragic)	
ἀπαρκτίαις πρηστῆρος αἴθωνος πνοαῖς.	u-u- --u --- u-	iambic trimeter (tragic)	
ἡ δ᾽ἔνθεον σχάσασα βακχεῖον στόμα,	- -u- u-u --- u-	iambic trimeter (tragic)	
ἄτης ἀπ᾽ ἄκρων βουπλανοκτίστων λόφων,	u- u -- -u--- u-	iambic trimeter (tragic)	
τοιῶνδ᾽ ἀπ᾽ ἀρχῆς ἦρχ᾽ Ἀλεξάνδρα λόγων·	-- u -- - u--- u-	iambic trimeter (tragic)	
αἰαῖ, τάλαινα θηλαμών, κεκαυμένη	-- u-u -u- u-u-	iambic trimeter (tragic)	
καὶ πρόσθε μὲν πεύκαισιν οὐλαμηφόροις	- -u - --u -u-u-	iambic trimeter (tragic)	
τριεσπέρου λέοντος, ὅν ποτε γνάθοις	u-u- u-u - u- u-	iambic trimeter (tragic)	
Τρίτωνος ἠμάλαψε κάρχαρος κύων·	u-u -u-u -u- u-	iambic trimeter (tragic)	
ἔμπνους δὲ δαιτρὸς ἡπάτων φλοιδούμενος	-- u -u -u- --u-	iambic trimeter (tragic)	
τινθῷ λέβητος ἀφλόγοις ἐπ᾽ ἐσχάραις	-- u-u -u- u -u-	iambic trimeter (tragic)	
σμήριγγας ἐστάλαξε κωδείας πέδῳ,	--u -u-u --- u-	iambic trimeter (tragic)	
ὁ τεκνοραίστης, λυμεὼν ἐμῆς πάτρας,	u -u-- -u- u- u-	iambic trimeter (tragic)	
ὁ δευτέραν τεκοῦσαν ἄτρωτον βαρεῖ	u -u- u-u --- u-	iambic trimeter (tragic)	
τύψας ἀτράκτῳ στέρνον, ἔν τ᾽αὐλῷ μέσῳ	-- u-- -u - -- u-	iambic trimeter (tragic)	
πατρὸς παλαιστοῦ χερσὶν ὀχμάσας δέμας	u- u-- -u -u- u-	iambic trimeter (tragic)	
Κρόνου παρ᾽ αἰπὺν ὄχθον, ἔνθα γηγενοῦς	u- u -u -u -u -u-	iambic trimeter (tragic)	
ἵππων ταρακτής ἐστιν Ἰσχένου τάφος,	-- u-- -u -u- u-	iambic trimeter (tragic)	
ὁ τὴν θαλάσσης Αὐσονίτιδος μυχοὺς	u - u-- -u-u- u-	iambic trimeter (tragic)	
στενοὺς ὀπιπεύουσαν ἀγρίαν κύνα	u- u---u -u- u-	iambic trimeter (tragic)	
κτανὼν ὑπὲρ σπήλυγγος ἰχθυωμένην,	u- u- --u -u-u-	iambic trimeter (tragic)	
ταυροσφάγον λέαιναν, ἣν αὖθις πατὴρ	--u- u-u - -- u-	iambic trimeter (tragic)	
σάρκας καταίθων λοφνίσιν δωμήσατο,	-- u-- -u- --u-	iambic trimeter (tragic)	
Λέπτυνιν οὐ τρέμουσαν, οὐδαίαν θεόν·	--u - u-u --- u-	iambic trimeter (tragic)	
ἐξηνάριξεν ὅν ποτ᾽ ἀξίφῳ δόλῳ	--u-u - u -u- u-	iambic trimeter (tragic)	
νέκυς, τὸν Ἅιδην δεξιούμενον πάλαι·	u- u -- -u-u- u-	iambic trimeter (tragic)	
λεύσσω σε, τλῆμον, δεύτερον πυρουμένην	-- u -- -u- u-u-	iambic trimeter (tragic)	
ταῖς τ᾽Αἰακείοις χερσὶ τοῖς τε Ταντάλου	- -u-- -u - u -u-	iambic trimeter (tragic)	
Λέτριναν οἰκουροῦσι λειψάνοις πυρὸς	u-u ---u -u- u-	iambic trimeter (tragic)	
παιδὸς καταβρωθέντος αἰθάλῳ δέμας,	-- u---u -u- u-	iambic trimeter (tragic)	
τοῖς Τευταρείοις βουκόλου πτερώμασι·	- -u-- -u- u-u-	iambic trimeter (tragic)	
τὰ πάντα πρὸς φῶς ἡ βαρύζηλος δάμαρ,	u -u - - - u--- u-	iambic trimeter (tragic)	
στείλασα κοῦρον τὸν κατήγορον χθονός,	--u -- - u-u- u-	iambic trimeter (tragic)	
ἄξει, πατρὸς μομφαῖσιν ἠγριωμένη,	-- u- --u -u-u-	iambic trimeter (tragic)	
λέκτρων θ᾽ἕκατι τῶν τ᾽ἐπεισάκτων γάμων.	-- u-u - u--- u-	iambic trimeter (tragic)	
αὐτὴ δὲ φαρμακουργός, οὐκ ἰάσιμον	-- u -u-u - u-u-	iambic trimeter (tragic)	
ἕλκος δρακοῦσα τοῦ ξυνευνέτου λυγρὸν	-- u-u - u-u- u-	iambic trimeter (tragic)	
Γιγαντοραίστοις ἄρδισιν τετρωμένου	u-u-- -u- u-u-	iambic trimeter (tragic)	
πρὸς ἀνθοπλίτου, ξυνὸν ὀγχήσει μόρον,	u -u-- -u --- u-	iambic trimeter (tragic)	
πύργων ἀπ᾽ ἄκρων πρὸς νεόδμητον νέκυν	-- u -- - u--- u-	iambic trimeter (tragic)	
ῥοιζηδὸν ἐκβράσασα κύμβαχον δέμας·	--u -u-u -u- u-	iambic trimeter (tragic)	
πόθῳ δὲ τοῦ θανόντος ἠγκιστρωμένη,	u- u - u-u ---u-	iambic trimeter (tragic)	
ψυχὴν περὶ σπαίροντι φυσήσει νεκρῷ.	u- u- --u --- u-	iambic trimeter (tragic)	
στένω, στένω σε δισσὰ καὶ τριπλᾶ, δορὸς	u- u- u -u - u- u-	iambic trimeter (tragic)	
αὖθις πρὸς ἀλκὴν καὶ διαρπαγὰς δόμων	-- u -- - u-u- u-	iambic trimeter (tragic)	
καὶ πῦρ ἐναυγάζουσαν αἰστωτήριον.	- - u---u ---u-	iambic trimeter (tragic)	
στένω σε, πάτρα, καὶ τάφους Ἀτλαντίδος	u- u -u - u- u-u-	iambic trimeter (tragic)	
δύπτου κέλωρος, ὅς ποτ᾽ ἐν ῥαπτῷ κύτει,	-- u-u - u - -- u-	iambic trimeter (tragic)	
ὁποῖα πορκὸς Ἰστριεὺς τετρασκελής,	u-u -u -u- u-u-	iambic trimeter (tragic)	
ἀσκῷ μονήρης ἀμφελυτρώσας δέμας,	-- u-- -u--- u-	iambic trimeter (tragic)	
Ῥειθυμνιάτης κέπφος ὣς ἐνήξατο,	--u-- -u - u-u-	iambic trimeter (tragic)	
Ζήρυνθον ἄντρον τῆς κυνοσφαγοῦς θεᾶς	--u -- - u-u- u-	iambic trimeter (tragic)	
λιπὼν ἐρυμνὸν κτίσμα Κυρβάντων Σάον,	u- u-- -u --- u-	iambic trimeter (tragic)	
ὅτ᾽ ἠμάθυνε πᾶσαν ὀμβρήσας χθόνα	u -u-u -u --- u-	iambic trimeter (tragic)	
Ζηνὸς καχλάζων νασμός· οἱ δὲ πρὸς πέδῳ	-- u-- -u - u - u-	iambic trimeter (tragic)	
πύργοι κατηρείποντο, τοὶ δὲ λοισθίαν	-- u---u - u -u-	iambic trimeter (tragic)	
νήχοντο μοῖραν προὐμμάτων δεδορκότες.	--u -- -u- u-u-	iambic trimeter (tragic)	
φηγὸν δὲ καὶ δρύκαρπα καὶ γλυκὺν βότρυν	-- u - u-u - u- u-	iambic trimeter (tragic)	
φάλλαι τε καὶ δελφῖνες αἵ τ᾽ἐπ᾽ ἀρσένων	-- u - --u - u -u-	iambic trimeter (tragic)	
φέρβοντο φῶκαι λέκτρα θουρῶσαι βροτῶν.	--u -- -u --- u-	iambic trimeter (tragic)	
λεύσσω θέοντα γρυνὸν ἐπτερωμένον	-- u-u -u -u-u-	iambic trimeter (tragic)	
τρήρωνος εἰς ἅρπαγμα Πεφναίας κυνός,	--u - --u --- u-	iambic trimeter (tragic)	
ἣν τόργος ὑγρόφοιτος ἐκλοχεύεται,	- -u -u-u -u-u-	iambic trimeter (tragic)	
κελυφάνου στρόβιλον ὠστρακωμένην.	u-u- u-u -u-u-	iambic trimeter (tragic)	
καὶ δή σε ναύτην Ἁχερουσία τρίβος	- - u -- -u-u- u-	iambic trimeter (tragic)	
καταιβάτις πύγαργον, οὐ πατρὸς κόπρους	u-u- u-u - u- u-	iambic trimeter (tragic)	
στείβοντα ῥακτῶν βουστάθμων, ξενώσεται,	--u -- -u- u-u-	iambic trimeter (tragic)	
ὡς πρόσθε, κάλλους τὸν θυωρίτην τριπλαῖς.	- -u -- - u-u- u-	iambic trimeter (tragic)	
ἀλλ᾽ ὀστρίμων μὲν ἀντὶ Γαμφηλὰς ὄνου	- -u- u -u --- u-	iambic trimeter (tragic)	
καὶ Λᾶν περάσεις, ἀντὶ δ᾽εὐχίλου κάπης	- - u-- -u -u- u-	iambic trimeter (tragic)	
καὶ μηλιαυθμῶν ἠδὲ χερσαίας πλάτης	- -u-- -u --- u-	iambic trimeter (tragic)	
τράμπις σ᾽ὀχήσει καὶ Φερέκλειοι πόδες	-- u-- - u--- u-	iambic trimeter (tragic)	
δισσὰς σαλάμβας κἀπὶ Γυθείου πλάκας,	-- u-- -u --- u-	iambic trimeter (tragic)	
ἐν αἷσι πρὸς κύνουρα καμπύλους σχάσας	u -u - u-u -u- u-	iambic trimeter (tragic)	
πεύκης ὀδόντας, ἕκτορας πλημμυρίδος,	-- u-u -u- --u-	iambic trimeter (tragic)	
σκαρθμῶν ἰαύσεις εἰναφώσσωνα στόλον.	-- u-- -u--- u-	iambic trimeter (tragic)	
καὶ τὴν ἄνυμφον πόρτιν ἁρπάσας λύκος,	- - u-- -u -u- u-	iambic trimeter (tragic)	
δυοῖν πελειαῖν ὠρφανισμένην γονῆς	u- u-- -u-u- u-	iambic trimeter (tragic)	
καὶ δευτέραν εἰς ἄρκυν ὀθνείων βρόχων	- -u- - -u --- u-	iambic trimeter (tragic)	
ληῖτιν ἐμπταίσασαν ἰξευτοῦ πτερῷ,	--u ---u --- u-	iambic trimeter (tragic)	
Θύσαισιν ἁρμοῖ μηλάτων ἀπάργματα	u-u -- -u- u-u-	iambic trimeter (tragic)	
φλέγουσαν ἐν κρόκαισι καὶ Βύνῃ θεᾷ,	u-u - u-u - u- u-	iambic trimeter (tragic)	
θρέξεις ὑπὲρ Σκάνδειαν Αἰγίλου τ᾽ἄκραν,	-- u- --u -u- u-	iambic trimeter (tragic)	
αἴθων ἐπακτὴρ καγχαλῶν ἀγρεύματι.	-- u-- -u- u-u-	iambic trimeter (tragic)	
νήσῳ δ᾽ἐνὶ δράκοντος ἐκχέας πόθον	-- u- u-u -u- u-	iambic trimeter (tragic)	
Ἀκτῆς, διμόρφου γηγενοῦς σκηπτουχίας,	-- u-- -u- --u-	iambic trimeter (tragic)	
τὴν δευτέραν ἕωλον οὐκ ὄψει Κύπριν,	- -u- u-u - -- u-	iambic trimeter (tragic)	
ψυχρὸν παραγκάλισμα κἀξ ὀνειράτων	u- u-u-u - u-u-	iambic trimeter (tragic)	
κεναῖς αφάσσων ὠλέναισι δέμνια.	u- u-- -u-u -u-	iambic trimeter (tragic)	
ὁ γάρ σε συλλέκτροιο Φλεγραίας πόσις	u - u ---u --- u-	iambic trimeter (tragic)	
στυγνὸς Τορώνης, ᾧ γέλως ἀπέχθεται	-- u-- - u- u-u-	iambic trimeter (tragic)	
καὶ δάκρυ, νῆις δ᾽ἐστὶ καὶ τητώμενος	- -u -- -u - --u-	iambic trimeter (tragic)	
ἀμφοῖν, ὁ Θρῄκης ἔκ ποτ᾽ εἰς ἐπακτίαν	-- u -- - u - u-u-	iambic trimeter (tragic)	
Τρίτωνος ἐκβολαῖσιν ἠλοκισμένην	u-u -u-u -u-u-	iambic trimeter (tragic)	
χέρσον περάσας, οὐχὶ ναυβάτῃ στόλῳ,	-- u-u -u -u- u-	iambic trimeter (tragic)	
ἀλλ᾽ ἀστίβητον οἶμον, οἷά τις σιφνεύς,	- -u-u -u -u - u-	iambic trimeter (tragic)	
κευθμῶνος ἐν σήραγγι τετρήνας μυχούς,	--u - --u --- u-	iambic trimeter (tragic)	
νέρθεν θαλάσσης ἀτραποὺς διήνυσε,	-- u-- -u- u-u-	iambic trimeter (tragic)	
τέκνων ἀλύξας τὰς ξενοκτόνους πάλας	-- u-- - u-u- u-	iambic trimeter (tragic)	
καὶ πατρὶ πέμψας τὰς ἐπηκόους λιτὰς	- -u -- - u-u- u-	iambic trimeter (tragic)	
στῆσαι παλίμπουν εἰς πάτραν, ὅθεν πλάνης	-- u-- - u- u- u-	iambic trimeter (tragic)	
Παλληνίαν ἐπῆλθε γηγενῶν τροφόν—	--u- u-u -u- u-	iambic trimeter (tragic)	
κεῖνός σε, Γουνεὺς ὥσπερ, ἐργάτης δίκης	-- u -- -u -u- u-	iambic trimeter (tragic)	
τῆς θ᾽Ἡλίου θυγατρὸς Ἰχναίας βραβεύς,	- -u- u-u --- u-	iambic trimeter (tragic)	
ἐπεσβολήσας λυγρὰ νοσφιεῖ γάμων,	u-u-- -u -u- u-	iambic trimeter (tragic)	
λίπτοντα κάσσης ἐκβαλὼν πελειάδος·	--u -- -u- u-u-	iambic trimeter (tragic)	
ὅς τοὺς Λύκου τε καὶ Χιμαιρέως τάφους	- - u- u - u-u- u-	iambic trimeter (tragic)	
χρησμοῖσι κυδαίνοντας οὐκ αἰδούμενος	--u ---u - --u-	iambic trimeter (tragic)	
οὐδ᾽ Ἀνθέως ἔρωτας οὐδὲ τὸν ξένοις	- -u- u-u -u - u-	iambic trimeter (tragic)	
σύνδορπον Αἰγαίωνος ἁγνίτην πάγον	--u ---u -u- u-	iambic trimeter (tragic)	
ἔτλης θεῶν ἀλοιτὸς ἐκβῆναι δίκην,	u- u- u-u --- u-	iambic trimeter (tragic)	
λάξας τράπεζαν κἀνακυπώσας Θέμιν,	-- u-- -u--- u-	iambic trimeter (tragic)	
ἄρκτου τιθήνης ἐκμεμαγμένος τρόπους.	-- u-- -u-u- u-	iambic trimeter (tragic)	
τοιγὰρ ψαλάξεις εἰς κενὸν νευρᾶς κτύπον,	-- u-- - u- -- u-	iambic trimeter (tragic)	
ἄσιτα κὰδώρητα φορμίζων μέλη·	u-u ---u --- u-	iambic trimeter (tragic)	
κλαίων δὲ πάτραν τὴν πρὶν ῇθαλωμένην	-- u -- - u -u-u-	iambic trimeter (tragic)	
ἵξῃ χεροῖν εἴδωλον ἠγκαλισμένος	-- u- --u -u-u-	iambic trimeter (tragic)	
τῆς πενταλέκτρου θυιάδος Πλευρωνίας.	- -u-- -u- --u-	iambic trimeter (tragic)	
γυιαὶ γὰρ εὐναστῆρας ἄμναμοι τριπλαῖς	-- u ---u --- u-	iambic trimeter (tragic)	
πήναις κατεκλώσαντο δηναιᾶς Ἁλός	-- u---u --- u-	iambic trimeter (tragic)	
νυμφεῖα πεντάγαμβρα δαίσασθαι γάμων.	--u -u-u --- u-	iambic trimeter (tragic)	
δοιὼ μὲν ἁρπακτῆρας αὐγάσει λύκους,	-- u ---u -u- u-	iambic trimeter (tragic)	
πτηνοὺς τριόρχας αἰετοὺς ὀφθαλμίας,	-- u-u -u- --u-	iambic trimeter (tragic)	
τὸν δ᾽ἐκ Πλυνοῦ τε κἀπὸ Καρικῶν ποτῶν	- - u- u -u -u- u-	iambic trimeter (tragic)	
βλαστόντα ῥίζης, ἡμικρῆτα βάρβαρον,	--u -- -u-u -u-	iambic trimeter (tragic)	
Ἐπειόν, οὐκ Ἀργεῖον ἀκραιφνῆ γοναῖς.	u-u - --u --- u-	iambic trimeter (tragic)	
οὗ πάππον ἐν γαμφαῖσιν Ἐνναία ποτὲ	- -u - --u --- u-	iambic trimeter (tragic)	
Ἕρκυνν᾽ Ἐρινὺς Θουρία Ξιφηφόρος	-- u-- -u- u-u-	iambic trimeter (tragic)	
ἄσαρκα μιστύλασα τύμβευσεν φάρῳ,	u-u -u-u --- u-	iambic trimeter (tragic)	
τὸν ὠλενὶτην χόνδρον ἐνδατουμένη.	u -u-- -u -u-u-	iambic trimeter (tragic)	
ὃν δὴ δὶς ἡβήσαντα καὶ βαρὺν πόθον	- - u ---u - u- u-	iambic trimeter (tragic)	
φυγόντα Ναυμέδοντος ἁρπακτήριον	u-u -u-u ---u-	iambic trimeter (tragic)	
ἔστειλ᾽ Ἐρεχθεὺς εἰς Λετριναίους γύας	-- u-- - u--- u-	iambic trimeter (tragic)	
λευρὰν ἀλετρεύσοντα Μόλπιδος πέτραν,	-- u---u -u- u-	iambic trimeter (tragic)	
τοῦ Ζηνὶ δαιτρευθέντος Ὀμβρίῳ δέμας,	- -u ---u -u- u-	iambic trimeter (tragic)	
γαμβροκτόνον ῥαίσοντα πενθεροφθόροις	--u- --u -u-u-	iambic trimeter (tragic)	
βουλαῖς ἀνἀγνοις, ἃς ὁ Καδμίλου γόνος	-- u-- - u -u- u-	iambic trimeter (tragic)	
ἤρτυσε. τὸν δὲ λοῖσθον ἐκπιὼν σκύφον	--u - u -u -u- u-	iambic trimeter (tragic)	
φερωνύμους ἔδυψε Νηρέως τάφους,	u-u- u-u -u- u-	iambic trimeter (tragic)	
πανώλεθρον κηλῖδα θωύξας γένει,	u-u- --u --- u-	iambic trimeter (tragic)	
ὁ τὴν πόδαργον Ψύλλαν ἡνιοστροφῶν	u - u-- -u -u-u-	iambic trimeter (tragic)	
καὶ τὴν ὁπλαῖς Ἅρπινναν Ἁρπυίαις ἴσην.	- - u- --u --- u-	iambic trimeter (tragic)	
τὸν δ᾽αὖ τέταρτον αὐθόμαιμον ὄψεται	- - u-u -u-u -u-	iambic trimeter (tragic)	
κίρκου καταρρακτῆρος, ὅν τε συγγόνων	-- u---u - u -u-	iambic trimeter (tragic)	
τὰ δευτερεῖα τῆς δαϊσφάλτου πάλης	u -u-u - u--- u-	iambic trimeter (tragic)	
λαβόντα κηρύξουσιν. ἐν δὲ δεμνίοις	u-u ---u - u -u-	iambic trimeter (tragic)	
τὸν ἐξ ὀνείρων πέμπτον ἐστροβημένον	u - u-- -u -u-u-	iambic trimeter (tragic)	
εἰδωλοπλάστῳ προσκαταξανεῖ ῥέθει,	--u-- -u-u- u-	iambic trimeter (tragic)	
τὸν μελλόνυμφον εὐνέτην Κυταϊκῆς,	- -u-u -u- u-u-	iambic trimeter (tragic)	
τῆς ξεινοβάκχης, ὅν ποτ᾽ Οἰνώνης φυγάς,	- -u-- - u --- u-	iambic trimeter (tragic)	
μύρμων τὸν ἑξάπεζον ἀνδρώσας στρατόν,	-- u -u-u --- u-	iambic trimeter (tragic)	
Πελασγικὸν Τυφῶνα γεννᾶται πατήρ,	u-u- u-u --- u-	iambic trimeter (tragic)	
ἀφ᾽ ἑπτὰ παίδων φεψάλῳ σποδουμένων	u -u -- -u- u-u-	iambic trimeter (tragic)	
μοῦνον φλέγουσαν ἐξαλύξαντα σποδόν.	-- u-u -u--- u-	iambic trimeter (tragic)	
χὠ μὲν παλιμπόρευτον ἵξεται τρίβον,	- - u-u-u -u- u-	iambic trimeter (tragic)	
σφῆκας δαφοινοὺς χηραμῶν ἀνειρύσας,	-- u-- -u- u-u-	iambic trimeter (tragic)	
ὁποῖα κοῦρος δῶμα κινήσας καπνῷ·	u-u -- -u --- u-	iambic trimeter (tragic)	
οἱ δ᾽αὖ προγεννήτειραν οὐλαμωνύμου	- - u---u -u-u-	iambic trimeter (tragic)	
βύκταισι χερνίψαντες ὠμησταὶ πόριν,	--u ---u --- u-	iambic trimeter (tragic)	
τοῦ Σκυρίου δράκοντος ἔντοκον λεχώ,	- -u- u-u -u- u-	iambic trimeter (tragic)	
ἣν ὁ ξύνευνος Σαλμυδησίας ἁλὸς	- - u-- -u-u- u-	iambic trimeter (tragic)	
ἐντὸς ματεύων, Ἑλλάδος καρατόμον,	-- u-- -u- u-u-	iambic trimeter (tragic)	
δαρὸν φαληριῶσαν οἰκήσει σπίλον	u- u-u-u --- u-	iambic trimeter (tragic)	
Κελτοῦ πρὸς ἐκβολαῖσι λιμναίων ποτῶν,	-- u -u-u --- u-	iambic trimeter (tragic)	
ποθῶν δάμαρτα, τήν ποτ᾽ ἐν σφαγαῖς κεμὰς	u- u-u - u - u- u-	iambic trimeter (tragic)	
λαιμὸν προθεῖσα φασγάνων ἒκ ῥύσεται.	-- u-u -u- u -u-	iambic trimeter (tragic)	
βαθὺς δ᾽ἔσω ῥηγμῖνος αὐδηθήσεται	u- u- --u ---u-	iambic trimeter (tragic)	
ἔρημος ἐν κρόκαισι νυμφίου δρόμος,	u-u - u-u -u- u-	iambic trimeter (tragic)	
στένοντος ἄτας καὶ κενὴν ναυκληρίαν	u-u -- - u- --u-	iambic trimeter (tragic)	
καὶ τὴν ἄφαντον εἶδος ἠλλοιωμένην	- - u-u -u ---u-	iambic trimeter (tragic)	
γραῖαν σφαγείων ἠδὲ χερνίβων πέλας	-- u-- -u -u- u-	iambic trimeter (tragic)	
Ἅιδου τε παφλάζοντος ἐκ βυθῶν φλογὶ	-- u ---u - u- u-	iambic trimeter (tragic)	
κρατῆρος, ὃν μέλαινα ποιφύξει φθιτῶν	u-u - u-u --- u-	iambic trimeter (tragic)	
σάρκας λεβητίζουσα δαιταλουργίᾳ.	-- u---u -u-u-	iambic trimeter (tragic)	
χὠ μὲν πατήσει χῶρον αἰάζων Σκύθην,	- - u-- -u --- u-	iambic trimeter (tragic)	
εἰς πέντε που πλειῶνας ἱμείρων λέχους.	- -u - --u --- u-	iambic trimeter (tragic)	
οἱ δ᾽ἀμφὶ βωμὸν τοῦ προμάντιος Κρόνου	- -u -- - u-u- u-	iambic trimeter (tragic)	
σὺν μητρὶ τέκνων νηπίων κρεανόμου	- -u -- -u- u-u-	iambic trimeter (tragic)	
ὅρκων τὸ δευτεροῦχον ἄρσαντες ζυγὸν	-- u -u-u --- u-	iambic trimeter (tragic)	
στερρὰν ἐνοπλίσουσιν ὠλέναις πλάτην,	-- u-u-u -u- u-	iambic trimeter (tragic)	
σωτῆρα Βάκχον τῶν πάροιθε πημάτων	--u -- - u-u -u-	iambic trimeter (tragic)	
Σφάλτην ἀνευάζοντες, ᾧ ποτ᾽ ἐν μυχοῖς	-- u---u - u - u-	iambic trimeter (tragic)	
Δελφινίου παρ᾽ ἄντρα Κερδῴου θεοῦ	--u- u -u --- u-	iambic trimeter (tragic)	
Ταύρῳ κρυφαίας χέρνιβας κατάρξεται	-- u-- -u- u-u-	iambic trimeter (tragic)	
ὁ χιλίαρχος τοῦ πολιρραίστου στρατοῦ.	u -u-- - u--- u-	iambic trimeter (tragic)	
ᾧ θυμάτων πρόσπαιον ἐκτίνων χάριν	- -u- --u -u- u-	iambic trimeter (tragic)	
δαίμων Ἐνόρχης Φιγαλεὺς Φαυστήριος	-- u-- -u- --u-	iambic trimeter (tragic)	
λέοντα θοίνης, ἴχνος ἐμπλέξας λύγοις,	u-u -- -u --- u-	iambic trimeter (tragic)	
σχήσει, τὸ μὴ πρόρριζον αἰστῶσαι στάχυν	-- u - --u --- u-	iambic trimeter (tragic)	
κείροντ᾽ ὀδόντι καὶ λαφυστίαις γνάθοις.	-- u-u - u-u- u-	iambic trimeter (tragic)	
λεύσσω πάλαι δὴ σπεῖραν ὁλκαίων κακῶν,	-- u- - -u --- u-	iambic trimeter (tragic)	
σύρουσαν ἅλμῃ κἀπιροιζοῦσαν πάτρᾳ	u-u -- -u--- u-	iambic trimeter (tragic)	
δεινὰς ἀπειλὰς καὶ πυριφλέκτους βλάβας.	-- u-- - u--- u-	iambic trimeter (tragic)	
Ὡς μή σε Κάδμος ὤφελ᾽ ἐν περιρρύτῳ	- - u -u -u - u-u-	iambic trimeter (tragic)	
Ἴσσῃ φυτεῦσαι δυσμενῶν ποδηγέτην,	-- u-- -u- u-u-	iambic trimeter (tragic)	
τέταρτον ἐξ Ἄτλαντος ἀθλίου σπόρον,	u-u - u-u -u- u-	iambic trimeter (tragic)	
τῶν αὐθομαίμων συγκατασκάπτην Πρύλιν,	- -u-- -u--- u-	iambic trimeter (tragic)	
τόμουρε πρὸς τὰ λῷστα νημερτέστατε·	u-u - u -u ---u-	iambic trimeter (tragic)	
μήδ᾽ Αἰσακείων οὑμὸς ὤφελεν πατὴρ	- -u-- -u -u- u-	iambic trimeter (tragic)	
χρησμῶν ἀπῶσαι νυκτίφοιτα δείματα,	-- u-- -u-u -u-	iambic trimeter (tragic)	
μιᾷ δὲ κρύψαι τοὺς διπλοῦς ὑπὲρ πάτρας	u- u -- - u- u- u-	iambic trimeter (tragic)	
μοίρᾳ, τεφρώσας γυῖα Λημναίῳ πυρί·	-- u-- -u --- u-	iambic trimeter (tragic)	
οὐκ ἂν τοσῶνδε κῦμ᾽ ἐπέκλυσεν κακῶν.	- - u-u - u-u- u-	iambic trimeter (tragic)	
καὶ δὴ Παλαίμων δέρκεται βρεφοκτόνος	- - u-- -u- u-u-	iambic trimeter (tragic)	
ζέουσαν αἰθυίαισι πλεκτανοστόλοις	u-u ---u -u-u-	iambic trimeter (tragic)	
