ἐξίκετʼ Οὔλυμπόν τε μέγαν καὶ δώματα πατρός.	-uu --- u u- - -uu --	dactylic hexameter	masculine penthemimeral, hepthemimeral
κύκνον δ᾽αὖ Κῆυξ θάπτεν καὶ λαὸς ἀπείρων,	-- - -- -- - -u u--	dactylic hexameter	masculine penthemimeral, hepthemimeral, trithemimeral
οἵ ῥ᾽ἐγγὺς ναῖον πόλιας κλειτοῦ βασιλῆος	- -- -- uu- -- uu--	dactylic hexameter	masculine penthemimeral, hepthemimeral, trithemimeral
Ἄνθην Μυρμιδόνων τε πόλιν κλειτήν τ᾽Ἰαωλκὸν	-- -uu- u u- -- uu--	dactylic hexameter	masculine penthemimeral, hepthemimeral
Ἄρνην τ᾽ἠδʼ Ἑλίκην· πολλὸς δ᾽ἠγείρετο λαός,	-- - uu- -- --uu --	dactylic hexameter	masculine penthemimeral, hepthemimeral, trithemimeral
τιμῶντες Κήυκα, φίλον μακάρεσσι θεοῖσιν.	--- -- -- uu-u u--	dactylic hexameter	masculine penthemimeral, hepthemimeral, trithemimeral
τοῦ δὲ τάφον καὶ σῆμʼ ἀιδὲς ποίησεν Ἄναυρος	- u u- - - -- --u u--	dactylic hexameter	masculine penthemimeral, hepthemimeral, trithemimeral
ὄμβρῳ χειμερίῳ πλήθων· τὼς γάρ μιν Ἀπόλλων	-- -uu- -- - - u u--	dactylic hexameter	masculine penthemimeral, hepthemimeral
Λητοΐδης ἤνωξʼ, ὅτι ῥα κλειτὰς ἑκατόμβας	-uu- -- uu - -- uu--	dactylic hexameter	masculine penthemimeral, hepthemimeral, trithemimeral
ὅστις ἄγοι Πυθοῖδε βίῃ σύλασκε δοκεύων.	-u u- --u u- --u u--	dactylic hexameter	feminine penthemimeral, hepthemimeral, trithemimeral
